,Title,Question,Answer
887,다 나앗으면 약 그만 먹어야 하나요저번 주에 임파선염이 생겨서 약 3일치 먹고 안나아서이번 주에 가서 약 바꿔서 4일치 타왔는데 2일치 먹었는데 이제 안아파요 귀 뒤에 부었던 것도 가라앉은 것 같고약 이틀치 남앗는데 그래도 계속 먹을까요?? 이제 안먹어도 되나요??,NA,​반갑습니다. 하이닥-네이버 지식iN 상담의사-이비인후과 전문의 최혁기-닥터초이 입니다.영상답변드립니다.감사합니다.  관련해서 더 궁금한 내용은  제 유튜브 채널 '여러분의 닥터초이'를  참고해주시면 좋겠습니다.
888,입술안 물집,7월초에 밥을 먹다가 입술안쪽을 씹어서 부엇엇는데 몇일후에 또 밥을먹다가 씹엇던곳을 또 씹엇어요 그러고나서 갠찮아지겟지하고 기다리고있는데 씹엇던곳이 물집처럼 생겼어요 왜 그런걸까요?,​반갑습니다. 하이닥-네이버 지식iN 상담의사-이비인후과 전문의 최혁기-닥터초이 입니다.영상답변드립니다.감사합니다. 점액낭종  관련해서 더 궁금한 내용은  제 유튜브 채널 '여러분의 닥터초이'를  참고해주시면 좋겠습니다.
889,"편도수술10일차 목젖,주위살부분 이물감과모양틀림","침삼킬때마다 뭔가부딪히는 이물감이들길래 목옆곱이안떨어져서 그것때문에 이물감이드나싶었는데 목젖부분과 (사진상오른쪽)목젖옆살부분이 닿는 기분이들어서너무불편합니다 ㅜㅜ모양도 약간사선으로 비대칭같은데원래 수술전에는 비대칭이아니였거든요오른쪽이 약간 쳐져있는것같은데 부기인건지시간이가면갈수록 올라가는건지 걱정입니다원래 수술하면 이부분도 건드리는건가요??!이런이물감은 당연한건가요,? 궁금합니다",​반갑습니다. 하이닥-네이버 지식iN 상담의사-이비인후과 전문의 최혁기-닥터초이 입니다.영상답변드립니다.감사합니다.
890,목안에 돌 침샘안에 돌?  아님 볼거리,3일전 자고 일어나니 왼쪽 목밑이 멍울이가 잡혀서이빈후과 갔는데 의사가 혀밑에 돌이 있거나가벼운 볼거리 증상이 있는것 같다고 합니다항생제 3일분 처방해주셨는데요먹고도 낳질않으면 큰병원 가라고 하셨는데요걱정입니다 열은안뜨구요 돌이면 수술하나요?,​반갑습니다. 하이닥-네이버 지식iN 상담의사-이비인후과 전문의 최혁기-닥터초이 입니다.영상답변드립니다.감사합니다.
891,편도적출했는데 모양이 왜이러죠??ㅠㅠ,12일전에 편도적출술을 받았습니다.다른분들과 다르게 저 목젖 모양이 이상하게 변해서요.. 단순히 부어서 그런건가요?? ㅠㅠ그리고 수술 깔끔하게 잘된거맞나요??사진이 좀 안좋지만 답변 부탁드립니다 불안해서요..피는 이미 출혈로 재수술을 두번을 더 한 상태인데도 또 나네요 ..하하,​반갑습니다. 하이닥-네이버 지식iN 상담의사-이비인후과 전문의 최혁기-닥터초이 입니다.영상답변드립니다.감사합니다.
892,닥터초이 선생님 도와주세요ㅠㅠ,안녕하세요 유튜브보고 너무친절하서서 이렇게문의드리게 되었습니다 제가 코감기약으로 슈다페드정이라는 알약을 먹었는데요 거기에성분이 슈도에페드린60mg이더라구요그런데 소방공무원 도핑테스트금지약물에 흥분제(에페드린)이라는 성분이 있어서 참 너무걱정이됩니다 잠도못자구 걱정만 하루종일하네요ㅠㅠ 도핑검사받기 7일전을 마지막으로 먹었던거같아요 3일정도복용을했구요... 혹시.. 도핑검사에서 양성이 뜰까요..ㅠㅠ 도와주십쇼ㅠㅠ 감사합니다,​반갑습니다. 하이닥-네이버 지식iN 상담의사-이비인후과 전문의 최혁기-닥터초이 입니다.영상답변드립니다.감사합니다.
893,편도선 부음 비염,코가 한쪽이 막힙니다. 옛날부터 편도선이 부엇는데 이거때문인가여?비염과 편도선 부은거랑 관련잇나여?편도선은 부은지 꽤 몇년됐습니다.코가 막힌걸 인지한건 몇개월 되었습니다,​반갑습니다. 하이닥-네이버 지식iN 상담의사-이비인후과 전문의 최혁기-닥터초이 입니다.영상답변드립니다.감사합니다. 코막힘 비중격만곡증  관련해서 더 궁금한 내용은  제 유튜브 채널 '여러분의 닥터초이'를  참고해주시면 좋겠습니다.
894,청력검사 및 어음청력도 검사 문의,어머니가 올해 82세이시고청력검사를 받아서 보청기를 하셨는데 소리가 울리기만 하고 별 효과를 보지 못하셨는데청각검사표를 보시고보청기를 착용해서 효과가 있는지 확인 좀 해주세요.보청기 착용후 왼쪽귀가 55dB 에서 32%까지 올랐다고 했는데언어 인지가 아예 안되는것인지?현재 보청기가 분실되어서 다시 해야 되는데 어떻게 하는게 좋은지부탁드립니다.,"안녕하세요. 하이닥-네이버 지식iN 상담의 안철민 입니다.보청기는 하시는 것이 맞고, 보청기 착용 후 소리는 들리고 울리면서 소리 변별이 안되는 것은 오랜 기간 난청으로 지내셨기 때문에 소리에 대한 뇌의 인식 기능이 저하되었기 때문입니다보청기 착용을 정확하게 하여야 하고, 보청기를 지속적으로 조절하면서 반복되는 청력검사를 하여야 합니다. 그리고 청능재활치료 등으로 보청기 착용 후 소리에 대한 감별이 가능하도록 지속되는 재활치료를 같이 하셔야 좋은 결과를 보시게 됩니다. 대개 보청기를 사서 착용하는 수준에서 멈추기 때문에 보청기의 효과를 충분히 보지 못하는 경우가 많습니다."
895,아이가 열있어서 병원갔더니 비염도있는데다가 감기까지 왔다고 하드라구요 하루약먹이고 나니깐 혀랑 입천장에 저런게있길래 걱정이됩니다 수족구인지 ㅠㅠ,아이가 열있어서 병원갔더니비염도있는데다가 감기까지왔다고 하드라구요하루약먹이고 나니깐 혀랑 입천장에저런게있길래 걱정이됩니다수족구인지 ㅠㅠ금요일부터 열은 잘안떨어지구요증상좀 봐주세요,"초보 부모를 위한 의사 아빠의 육아 상식 사전저자서정호출판길벗발매2020. 01. 02.안녕하세요. 하이닥-네이버 지식iN 상담의 서정호 입니다.​수족구인지는 입안 전체도 살펴보고, 손발에 발진이 있는지도 살펴 보아야 합니다.​발진이 더 생기는 것 같다면 소아과에서 진료를 다시 보시기 바랍니다.​다만, 현재 입안에 있는 증상 때문에 다른 약을 추가로 처방하지는 않습니다.​다음은 수족구병에 대한 제 블로그에 있는 관련 내용입니다.  참조하시기 바랍니다.​수족구병의 모든 것수족구병의 모든 것 최근 소아과를 찾는 대표적인 질환은 ‘수족구병’입니다.​ 과거와는 달리 연중 유행...blog.naver.com​"
896,후비루증후군하고 편도결석하고 연관이 있나요?,제가 콧물이 목 쪽으로 자꾸 넘어가는 후비루증후군이 있습니다.그런데 얼마 전부터 노란 쌀 알갱이 같은 게 입에서 나오고 입냄새도 나더라구요찾아보니까 이게 편도결석 같은데편도결석 원인 중 하나가 후비루증후군 때문일 수 있다고 하더라구요근데 제가 후비루증후군은 완치 같은 게 없다고 알고 있는데그럼 편도결석도 평생 치료할 수 없는 건가요?,"안녕하세요. 하이닥-네이버 지식iN 상담의 이용배 입니다.​비염이나 축농증 등 코질환이 있으면 편도결석이 더 잘생길 수 있습니다.비염이나 축농증으로 인해 콧물이 목으로 넘어가서(후비루) 입안에 세균이 번식하기 쉽고이로 인해 편도결석이 생길 가능성도 커집니다.우선은 후비루의 원인질환인 비염이나 축농증을 적절히 치료하고,편도결석이 자주 생기거나 만성편도염이 자주 발생하는 경우에는 편도절제술을 통해 치료 가능하십니다.이비인후과에 내원하셔서 적절한 치료를 받아보시기 바랍니다."
897,코막힘 치료 방법이 따로 있나요?,제가 원래부터 코가 되게 잘 막히고 그런 편인데그럴 때마다 코막힘 스프레이로 해결하고 그랬거든요근데 그것도 너무 일시적인 방법이고 너무 스프레이를 자주 사용하게 되는 것 같아요즘에는 잘 안하고 있어요코막힘 치료를 받고 싶은데 혹시 이외에 코막힘 치료 방법이 따로 있을까요?,"안녕하세요. 하이닥-네이버 지식iN 상담의 이용배 입니다.​코막힘 치료는 원인에 따라 달라지게 됩니다.코막힘을 유발하는 코질환은 비중격만곡증, 비염, 축농증, 코물혹 등이 있습니다.이 질환들이 각각 나타나는 경우도 있고, 함께 나타나는 경우도 있는데요.비염의 경우 맑은 콧물이나 재채기가 동반될 수 있으며축농증은 누런콧물,후비루 등의 증상이 동반되기도 합니다.원인질환에 따라서 약물치료도 달라지게 되며, 계속해서 증상이 지속된다면질환에 맞는 수술을 고려해볼 수 있습니다.여러 질환이 함께 나타나는 경우에는 함께 수술을 진행하는 경우도 있습니다.감사합니다."
898,비염콧물재채기 증상 없애는 방법,제가 비염콧물재채기가 좀 많이 심한 편인데요..공공장소에 오래 머물기가 부끄러워요 ㅠㅠ도서관 같은 데서 사람들이 눈치도 주고저 스스로도 일상생활이 힘들어져서요..무슨 수를 써서라도 비염콧물재채기 증상을 없애고 싶어요 ㅠ혹시 치료가 가능할까요?..,"안녕하세요. 하이닥-네이버 지식iN 상담의 정도광 입니다.​콧물 재채기 증상이 있다면 알레르기비염을 의심해볼 수 있습니다.알레르기비염은 먼저 증상을 유발하는 원인 항원이 무엇인지 정확한 검사를 통해 확인해보시는 것이 좋습니다.가장 먼저 원인 항원을 피하는 회피요법을 기본으로 합니다. 이와 함께 약물치료와 생리식염수를 이용한 코세척을 병행해볼 수 있습니다.증상이 계속 지속되고 축농증이나 비중격만곡증이 동반된다면 수술치료를 고려해보기도 합니다.또, 장기적인 방법이지만 소량의 원인 알레르겐을 지속적으로 투여하여 항체가 생기도록 하는 면역요법도 있습니다.이비인후과에 내원하셔서 정확한 상담을 받아보시기 바랍니다."
899,비염수술 하고나서 흡연 가능한 기간,일주일 전에 비염수술을 받아 어쩔 수 없이 금연 중인데요.하루에 담배 한 갑을 다 비울 정도로 애연가였던지라슬슬 금단 현상이 와서 너무 힘듭니다.비염수술 후에 담배를 피우려면 언제까지 기다려야 하나요?하루에 한 개피 정도 피우는 건 괜찮을까요?,안녕하세요. 하이닥-네이버 지식iN 상담의 정도광 입니다.​비염 수술 후 금연과 금주를 최소 2~3개월은 해주셔야 합니다.특히 담배는 좀 더 직접적인 영향을 끼칩니다.코 점막 표면은 눈으로 보이지 않을 정도의 가는 섬모로 덮여있는데이것이 콧속 분비물을 아래로 운반하는 기능을 합니다.그런데 담배 연기나 매연과 같은 자극 물질은 섬모의 운동성을 떨어뜨립니다.따라서 직접 흡연은 물론 간접 흡연도 피하는 것이 좋습니다.
900,"보청기 맞추기 전, 불쾌치 검사에서 헤드셋으로 90~105데시벨 까지 소리르 들었는데 괜찮을까요?","보청기 맞추기 전, 불쾌치 검사에서 헤드셋으로 90~105데시벨 까지 소리르 들었는데 괜찮을까요?90~105데시벨에서 불쾌함을 느껴서 버튼을 누르고 그 다음 주파수로 넘어가고 이랬는데..100, 105데시벨에서 불쾌함을 느껴서 누른 횟수도 제법 포함되어 있습니다.헤드셋을 끼고 검사를 하는데 100, 105데시벨의 소리를 헤드셋으로 직접 들으면 귀가 다칠 수 있는 것이 아닌가 조금 걱정이 됩니다. 기존의 난청과 이명이 더 심해질 수 있을 지 걱정이 됩니다.소리는 1초정도 삐- 하는 소리를 들려주었습니다.그럼 청각사, 청능사, 또는 이비인후과 의사분들의 답변 부탁 드립니다.감사합니다.","안녕하세요. 하이닥-네이버 지식iN 상담의 유신영 입니다.청력검사로 청력이 더 손상될 수 있다고 생각하지 않았으면 합니다.청각 검사는 환자분의 치료를 위해 정확한 진단이 필요하고 그래서 개발이 된 검사들입니다.이 검사들이 청력을 더 손상시킨다면 검사할 이유가 없어지게 되겠지요..이렇게 말씀을 드리면 대부분의 환자분들은 몰라서 물어본다고 합니다...저는 몰라서 물어보는 것이 아니고 불안해서, 걱정이 되서 이런 질문을 한다고 생각합니다.절대 청력이 망가질 일이 없으니 안심하시길 바라고 불쾌역치 값이 100dB이 넘는 것은 정상인과 동일한 수치로보청기를 착용함에도 불구하고 누가 현상이 없는, 따라서 보청기 적응이 수월하실 가능성이 높은 분으로 생각합니다.보청기를 피팅하기전에 불쾌 역치를 측정하는 것은 매우 세밀한 접근으로 어디인지는 모르겠으나 그 기관의 신뢰도가 높다고 할 수 있겠습니다. 믿고 잘 착용하시길 바랍니다."
901,귀에 염증난거요~ 수술해야하나요?,사진에 보시다시피 귀에 염증이 났어요 ㅠㅠ 안에 고름도 찬 것 같은데 수술을 해야하나요?? 병원가서 약도 지어먹었는데 낫지가 않네요,전이개 누공 (preauricular fistula) 에 감염이 생겼네요절개해서 농을 배출 및 소독과 항생제 포함한 약물치료를 해서 가라앉힌 후에나중에 귀앞의 작은 구멍을 포함해서 안쪽의 병소를 제거하는 수술을 하셔야 합니다.이비인후과 진료를 보셔야합니다.
902,편도결석 때문에 편도가 부은거 같아요,"후레쉬로 보니까 양쪽으로 편도결석이 엄청 많더라고요.본인기준으로 왼쪽에 엄청 많고, 오른쪽은 2개? 3개?이거 제거하려면 이비인후과 가야하나요? 치과가야하나요?비용은 얼마정도 하나요?아 그리고 가래도 엄청끼는데 왜 이럴까요","안녕하세요. 대한의사협회·네이버 지식iN 상담의사 이비인후과 전문의 문인희 입니다.​편도결석은 이비인후과에서 치료 가능합니다.​편도결석은 생명에 지장이 되는 심각한 문제가 아니기 때문에 이비인후과 의사선생님중에도 치료방침에 대해 의견이 다를 수 있습니다.심각한 문제가 아니니 그냥 참고 살아도 된다는 의견을 가진 분과,냄새나는 알갱이와 이물감이 반복되어 불편하면 적극적인 치료가 필요하다는 의견이 있습니다.편도결석에 관심이 많은 의사선생님은 편도결석을 앓는 분들에 대해 더 관심을 기울이고 편도결석 치료를 더 적극적으로 시도하는 경향이 있습니다.​​편도결석을 손톱이나 면봉,뾰족한 기구 등으로 편도를 후벼 파는 것은 점막손상을 일으킬 수도 있고 불결하기 때문에 권유되지 않습니다.임시로라도 제거하려면 가까운 이비인후과에 가셔서 흡입기,이어루프,포셉 등으로 제거하실 수 있습니다. 임시로 단순제거하는 비용은 건강보험 적용되어 1만원 정도입니다.​그러나 편도결석의 근본적인 치료를 원하신다면,근본적인 해결방법은 수술밖에 없습니다.편도결석을 생길 때 마다 빼 낸다 하더라도 편도홈의 구조가 바뀌지 않는 한,편도결석은 계속 생기게 되며,그런 구조를 그대로 둔 상태에서 편도결석을 예방하는 방법이나 안생기게 하는 방법은 없습니다.​편도결석이 일반 편도염처럼 약물치료가 잘 안되는 이유는,편도결석의 주요세균은 혐기성 세균이며,균막(biofilm)과 유사한 성상을 하고 있기 때문입니다.균막이란 단순한 세균덩어리가 아니라,마치 에스키모의 얼음집인 이글루처럼,세균들 덩어리를 견고한 외벽이 감싸고 보호하는 구조이기 때문에,양치질,가글,음식이나 한약은 물론이고 항생제로도 치료가 어렵습니다.이비인후과에서 임시방편으로 흡입기로 제거할 수는 있고,편도결석이 있어도 심각한 문제는 아니지만,근본적인 치료를 위해서는 수술이 필요합니다.​편도결석 수술은 편도결석이 생기는 홈부위를 레이저나 고주파 기기를 이용하여 편도 홈 깊이만큼 제거하는‘편도부분절제술’과,편도를 모두 제거하는‘편도완전적출술’이 있습니다.편도의 면역기능은4-5세경의 소아기 까지는 중요한 역할을 하지만,그 이후에는 다른 면역기관이 활성화되므로,편도가 없어도 면역체계에 전혀 문제가 되지 않습니다.​‘편도완전적출술’은 한번에 편도를 피막까지 제거하기 때문에 재발의 가능성은 거의 없지만 출혈과 통증이 더 심하고 수일간의 입원이 필요합니다.가끔 국소마취로 편도완전적출술을 하기도 하지만,대부분 편도완전적출술은 전신마취를 하게 됩니다.편도완전적출술은 보통 수술시간이1시간 정도 걸리고,편도완전적출술을 받는 경우는 대개 통증이 매우 심한 편이고2주정도 극심한 통증이 있습니다.편도가 매우 크거나 잦은 편도염을 앓는다면 편도완전적출술이 필요합니다.​편도결석의 간편한 치료법인 레이저나 고주파를 이용한‘편도부분절제술’은 통증과 출혈은 적고 국소마취로 수술받으실 수 있는데,가끔 추가수술이 필요한 경우가 있습니다.수술시간은20~30분 정도 걸립니다.편도를 부분적으로 제거하는 수술방법은,각 개인의 편도 홈 깊이에 따라 차이가 있지만,편도완전적출술에 비해 평균 절반정도의 통증이 일주일정도 갑니다. ‘편도부분절제술’만로도 대부분의 편도결석이 해결가능합니다.초창기 레이저만으로 하던 수술방법에서 요즘은 고주파를 같이 사용하는 방법으로 더 발전되어 재발률이 줄어들었습니다.​2015년 이비인후과 학회지에 게재된 논문에 따르면,레이저와 고주파를 동시에 사용한‘피막(캡슐)내 편도부분절제술’ 1차례 수술만으로2년 이상 경과관찰 결과92.7%에서 편도결석이 치료되었다고 보고되었습니다.‘편도부분절제술’은 최근에 알려진 수술방법이기 때문에 집도자에 따라 수술의 예후가 차이가 날 수 있습니다.​편도결석을 수술해야 할 것인지는 본인이 얼마나 불편한지에 따라 결정하시면 됩니다.편도결석이 있어도 심각한 문제는 아니지만,그런 불쾌하고 불편한 증상을 근본적으로 없애고 싶으시다면 수술로 완치할 수 있습니다.​가래는 편도결석과 별개의 증상이므로 이비인후과 전문의의 진찰후에 원인질환에 따른 적절한 치료를 받으시기 바랍니다.불편감이 있으면  이비인후과 전문의의 진찰을 받아보시기 바랍니다.​​"
903,저음성 난청 질문이요,오늘 아침에 일어나니깐 귀가 멍멍하고 웅웅 거리는 것 같아서 일단 평소처럼 생활했는데 오후가 되어도 나아지지 않아서 이비인후과를 방문했습니다청력테스트를 하라해서 했는데 저음성 난청이라는 진단을 받았습니다근데.. 예전에는 이런 적 있어도 생활하다보면 괜찮아졌는데 난청이라하니 너무 당황스럽더라고요그리고 청력테스트 한번으로 이 결과를 맞다고 말할 수가 있는걸까요?우선 스테로이드 약을 처방해주셨습니다,​반갑습니다. 하이닥-네이버 지식iN 상담의사-이비인후과 전문의 최혁기-닥터초이 입니다.영상답변드립니다.감사합니다.  갑자기 생긴 귀 먹먹함 관련해서 더 궁금한 내용은  제 유튜브 채널 '여러분의 닥터초이'를  참고해주시면 좋겠습니다.
904,"편도선, 목에 볼록 튀어나온 혹(?)같은거 질문합니다",학생입니다보통 편도선이 부었을때 볼록 튀어나오는 하악삼각부(중에 위쪽) 요 부분이 한두달전부터 계속 손으로 만졌을때 볼록 튀어나와있고 가끔씩 따끔거린다거나 타는듯한 느낌도 있어요.. 평소 편도선이 부었을때랑은 다른 통증 같아서 살짝 걱정되는 마음에 질문해봅니다 ㅜㅜ 이비인후과에 가봤는데 제 목에 뭐가 튀어나왔단 얘기는 안했고 의사선생님이 입벌려서 간단히 보셨는데 살짝 빨갛기만하고 괜찮다고는 하셨어요 그래도 안보이는 곳에 뭐가 있는건 아닐까하고ㅜㅜ 질문해봐요.. 답변 주시면 감사합니다..,​반갑습니다. 하이닥-네이버 지식iN 상담의사-이비인후과 전문의 최혁기-닥터초이 입니다.영상답변드립니다.감사합니다.  목에 혹이 만져지는 것에 대해서  더 궁금한 내용은  제 유튜브 채널 '여러분의 닥터초이'를  참고해주시면 좋겠습니다.
905,"볼거리, 이하선염 환자인데 단백질 보충제 먹어도되나요?? 내공100lala****채택률61%마감률61%????????? 먹어도상관없죠",NA,반갑습니다. 하이닥-네이버 지식iN 상담의사-이비인후과 전문의 최혁기-닥터초이 입니다.영상답변드립니다.감사합니다.  볼거리 관련해서 더 궁금한 내용은  제 유튜브 채널 '여러분의 닥터초이'를  참고해주시면 좋겠습니다.반갑습니다. 하이닥-네이버 지식iN 상담의사-이비인후과 전문의 최혁기-닥터초이 입니다.영상답변드립니다.감사합니다.  볼거리 관련해서 더 궁금한 내용은  제 유튜브 채널 '여러분의 닥터초이'를  참고해주시면 좋겠습니다.
906,편도선이 아파요ㅠㅠ,양쪽이 아니라 오른쪽 편도선만 침삼킬때 좀 불편하고 아프길래 후레시 비춰서 봐봤더니 어느 부분부분만 부어있고 좀 빨갛게 핏줄같은게 보이는데 왜그럴까요?ㅠㅠ,​반갑습니다. 하이닥-네이버 지식iN 상담의사-이비인후과 전문의 최혁기-닥터초이 입니다.영상답변드립니다.감사합니다.  관련해서 더 궁금한 내용은  제 유튜브 채널 '여러분의 닥터초이'를  참고해주시면 좋겠습니다.
907,목에 가래가 낀 느낌,목에 가래낀 느낌이 너무 심해요ㅠㅠ 자려고 누우면 목에 이물감 때문에 계속 신경쓰여서 자지도 못하고 물을 계속 먹어도 그대로에요ㅠㅠ 침을 계속 삼켜도 안 넘어가고 계속 침을 삼키니까 목이 너무 건조해 지더라구요 몇주동안 이런 상황인데 요즘 병원도 잘 못가겠어서ㅠㅠㅠ 집에서 나아질 수 있는 방법이 있을까요?,​반갑습니다. 하이닥-네이버 지식iN 상담의사-이비인후과 전문의 최혁기-닥터초이 입니다.영상답변드립니다.감사합니다.  인후두역류증 관련해서 더 궁금한 내용은  제 유튜브 채널 '여러분의 닥터초이'를  참고해주시면 좋겠습니다.
908,오프로신 이용액,귀 안에 귀지 녹이려고 오프로신 이용액 처방받았는데 약국에서 6~10방울 넣으라해서 넣고 20분 정도 누워있었는데 귀가 먹먹해요ㅠㅠ 정상인가요?,​반갑습니다. 하이닥-네이버 지식iN 상담의사-이비인후과 전문의 최혁기-닥터초이 입니다.영상답변드립니다.감사합니다.  관련해서 더 궁금한 내용은  제 유튜브 채널 '여러분의 닥터초이'를  참고해주시면 좋겠습니다.
909,피어싱 고름(?) 도와주세요 ㅠ,피어싱한지 7-8개월 되어가구요몰랐는데 오늘 거울 보니까 귀에 염증이 생긴건지...병원말고 자가치료방법있나여?피어싱 빼기싫른데 빼면 막히겠죠? ㅠㅠㅠㅠ후시딘을 발라야할까요..?,​반갑습니다. 하이닥-네이버 지식iN 상담의사-이비인후과 전문의 최혁기-닥터초이 입니다.영상답변드립니다.감사합니다.  관련해서 더 궁금한 내용은  제 유튜브 채널 '여러분의 닥터초이'를  참고해주시면 좋겠습니다.
910,귀 속에 하얀게 있어요 이거 뭔가요ㅠㅠㅠ,귀파는데 후레시 비춰보니까 이런 하얀 반짝인게 있대요ㅠㅠㅠㅠ 양 쪽 다 있어요ㅠㅠ이게 뭘까요ㅠㅠㅠ,​반갑습니다. 하이닥-네이버 지식iN 상담의사-이비인후과 전문의 최혁기-닥터초이 입니다.영상답변드립니다.감사합니다.  관련해서 더 궁금한 내용은  제 유튜브 채널 '여러분의 닥터초이'를  참고해주시면 좋겠습니다.
